[
 {
  "id": "alchemical_blast",
  "name": "Alchemical Blast",
  "template": "DIRECT_DAMAGE",
  "speed": "fast",
  "cost": 2,
  "color": "fire",
  "params": {
   "amount": 2,
   "target": "ENEMY_UNIT",
   "apply_status": "FROZEN",
   "status_duration": 1
  },
  "description": "Deal 2 damage to an enemy unit (freezes the target)."
 },
 {
  "id": "beaker_blast",
  "name": "Beaker Blast",
  "template": "DIRECT_DAMAGE",
  "speed": "fast",
  "cost": 2,
  "color": "fire",
  "params": {
   "amount": 2,
   "target": "ENEMY_UNIT",
   "self_damage": 1
  },
  "description": "Deal 2 damage to an enemy unit (also damages itself)."
 },
 {
  "id": "blazing_salvo",
  "name": "Blazing Salvo",
  "template": "DIRECT_DAMAGE",
  "speed": "fast",
  "cost": 3,
  "color": "fire",
  "params": {
   "amount": 3,
   "target": "ENEMY_UNIT",
   "apply_status": "FROZEN",
   "status_duration": 1
  },
  "description": "Deal 3 damage to an enemy unit (freezes the target)."
 },
 {
  "id": "boiling_geyser",
  "name": "Boiling Geyser",
  "template": "DIRECT_DAMAGE",
  "speed": "slow",
  "cost": 4,
  "color": "fire",
  "params": {
   "amount": 2,
   "target": "ALL_ENEMY_UNITS",
   "apply_status": "FROZEN",
   "status_duration": 1
  },
  "description": "Deal 2 damage to all enemy units (freezes the target)."
 },
 {
  "id": "breath_of_voprex",
  "name": "Breath of Voprex",
  "template": "DIRECT_DAMAGE",
  "speed": "slow",
  "cost": 6,
  "color": "fire",
  "params": {
   "amount": 4,
   "target": "ALL_ENEMY_UNITS",
   "apply_status": "FROZEN",
   "status_duration": 1
  },
  "description": "Deal 4 damage to all enemy units (freezes the target)."
 },
 {
  "id": "burn_out",
  "name": "Burn Out",
  "template": "DIRECT_DAMAGE",
  "speed": "fast",
  "cost": 3,
  "color": "fire",
  "params": {
   "amount": 4,
   "target": "ENEMY_UNIT",
   "self_damage": 2
  },
  "description": "Deal 4 damage. Your nexus takes 2."
 },
 {
  "id": "burn_them_all",
  "name": "Burn Them All",
  "template": "DIRECT_DAMAGE",
  "speed": "slow",
  "cost": 5,
  "color": "fire",
  "params": {
   "amount": 2,
   "target": "ALL_ENEMY_UNITS"
  },
  "description": "Deal 2 damage to all enemy units."
 },
 {
  "id": "chakram_throw",
  "name": "Chakram Throw",
  "template": "DIRECT_DAMAGE",
  "speed": "fast",
  "cost": 2,
  "color": "fire",
  "params": {
   "amount": 2,
   "target": "ANY_UNIT",
   "apply_status": "FROZEN",
   "status_duration": 1
  },
  "description": "Deal 2 damage to any unit (freezes the target)."
 },
 {
  "id": "char",
  "name": "Char",
  "template": "DIRECT_DAMAGE",
  "speed": "fast",
  "cost": 1,
  "color": "fire",
  "params": {
   "amount": 1,
   "target": "ENEMY_UNIT"
  },
  "description": "Deal 1 damage to an enemy unit."
 },
 {
  "id": "chemtrail_burst",
  "name": "Chemtrail Burst",
  "template": "DIRECT_DAMAGE",
  "speed": "slow",
  "cost": 4,
  "color": "fire",
  "params": {
   "amount": 2,
   "target": "ALL_ENEMY_UNITS",
   "self_damage": 1
  },
  "description": "Deal 2 damage to all enemy units (also damages itself)."
 },
 {
  "id": "chloric_mix",
  "name": "Chloric Mix",
  "template": "DIRECT_DAMAGE",
  "speed": "fast",
  "cost": 3,
  "color": "fire",
  "params": {
   "amount": 3,
   "target": "ENEMY_UNIT",
   "self_damage": 1
  },
  "description": "Deal 3 damage to an enemy unit (also damages itself)."
 },
 {
  "id": "chronostorm",
  "name": "Chronostorm",
  "template": "DIRECT_DAMAGE",
  "speed": "slow",
  "cost": 7,
  "color": "time",
  "params": {
   "amount": 5,
   "target": "ALL_ENEMY_UNITS"
  },
  "description": "Deal 5 damage to all enemy units."
 },
 {
  "id": "conflagrate",
  "name": "Conflagrate",
  "template": "DIRECT_DAMAGE",
  "speed": "slow",
  "cost": 5,
  "color": "fire",
  "params": {
   "amount": 3,
   "target": "ALL_ENEMY_UNITS",
   "apply_status": "FROZEN",
   "status_duration": 1
  },
  "description": "Deal 3 damage to all enemy units (freezes the target)."
 },
 {
  "id": "cremate",
  "name": "Cremate",
  "template": "DIRECT_DAMAGE",
  "speed": "fast",
  "cost": 3,
  "color": "shadow",
  "params": {
   "amount": 3,
   "target": "ENEMY_UNIT",
   "apply_status": "FROZEN",
   "status_duration": 1
  },
  "description": "Deal 3 damage to an enemy unit (freezes the target)."
 },
 {
  "id": "crashing_avalanche",
  "name": "Crashing Avalanche",
  "template": "DIRECT_DAMAGE",
  "speed": "slow",
  "cost": 6,
  "color": "time",
  "params": {
   "amount": 4,
   "target": "ALL_ENEMY_UNITS"
  },
  "description": "Deal 4 damage to all enemy units."
 },
 {
  "id": "crack_the_earth",
  "name": "Crack the Earth",
  "template": "DIRECT_DAMAGE",
  "speed": "slow",
  "cost": 5,
  "color": "time",
  "params": {
   "amount": 2,
   "target": "ALL_ENEMY_UNITS"
  },
  "description": "Deal 2 damage to all enemy units."
 },
 {
  "id": "dragon_forge",
  "name": "Dragon Forge",
  "template": "DIRECT_DAMAGE",
  "speed": "slow",
  "cost": 6,
  "color": "fire",
  "params": {
   "amount": 4,
   "target": "ALL_ENEMY_UNITS",
   "self_damage": 1
  },
  "description": "Deal 4 damage to all enemy units (also damages itself)."
 },
 {
  "id": "dunewave",
  "name": "Dunewave",
  "template": "DIRECT_DAMAGE",
  "speed": "slow",
  "cost": 4,
  "color": "time",
  "params": {
   "amount": 2,
   "target": "ALL_ENEMY_UNITS",
   "apply_status": "FROZEN",
   "status_duration": 1
  },
  "description": "Deal 2 damage to all enemy units (freezes the target)."
 },
 {
  "id": "firebomb",
  "name": "Firebomb",
  "template": "DIRECT_DAMAGE",
  "speed": "fast",
  "cost": 4,
  "color": "fire",
  "params": {
   "amount": 4,
   "target": "ENEMY_UNIT",
   "apply_status": "FROZEN",
   "status_duration": 1
  },
  "description": "Deal 4 damage to an enemy unit (freezes the target)."
 },
 {
  "id": "flash_fry",
  "name": "Flash Fry",
  "template": "DIRECT_DAMAGE",
  "speed": "fast",
  "cost": 3,
  "color": "fire",
  "params": {
   "amount": 3,
   "target": "ANY_UNIT"
  },
  "description": "Deal 3 damage to an enemy unit (any unit)."
 },
 {
  "id": "flash_grenade",
  "name": "Flash Grenade",
  "template": "DIRECT_DAMAGE",
  "speed": "fast",
  "cost": 2,
  "color": "fire",
  "params": {
   "amount": 2,
   "target": "ANY_UNIT",
   "self_damage": 1
  },
  "description": "Deal 2 damage to any unit (also damages itself)."
 },
 {
  "id": "forked_lightning",
  "name": "Forked Lightning",
  "template": "DIRECT_DAMAGE",
  "speed": "fast",
  "cost": 3,
  "color": "primal",
  "params": {
   "amount": 3,
   "target": "ENEMY_UNIT",
   "apply_status": "FROZEN",
   "status_duration": 1
  },
  "description": "Deal 3 damage to an enemy unit (freezes the target)."
 },
 {
  "id": "free_fire",
  "name": "Free Fire",
  "template": "DIRECT_DAMAGE",
  "speed": "fast",
  "cost": 2,
  "color": "fire",
  "params": {
   "amount": 2,
   "target": "ANY_UNIT"
  },
  "description": "Deal 2 damage to an enemy unit (any unit)."
 },
 {
  "id": "frost",
  "name": "Frost",
  "template": "DIRECT_DAMAGE",
  "speed": "fast",
  "cost": 2,
  "color": "primal",
  "params": {
   "amount": 2,
   "target": "ANY_NEXUS",
   "apply_status": "FROZEN",
   "status_duration": 1
  },
  "description": "Deal 2 damage to a nexus. Apply Frozen."
 },
 {
  "id": "frostwave",
  "name": "Frostwave",
  "template": "DIRECT_DAMAGE",
  "speed": "slow",
  "cost": 4,
  "color": "primal",
  "params": {
   "amount": 2,
   "target": "ALL_ENEMY_UNITS",
   "apply_status": "FROZEN",
   "status_duration": 1
  },
  "description": "Deal 2 damage and Freeze all enemy units."
 },
 {
  "id": "funeral_pyre",
  "name": "Funeral Pyre",
  "template": "DIRECT_DAMAGE",
  "speed": "fast",
  "cost": 4,
  "color": "shadow",
  "params": {
   "amount": 4,
   "target": "ENEMY_UNIT",
   "apply_status": "FROZEN",
   "status_duration": 1
  },
  "description": "Deal 4 damage to an enemy unit (freezes the target)."
 },
 {
  "id": "gilded_flames",
  "name": "Gilded Flames",
  "template": "DIRECT_DAMAGE",
  "speed": "slow",
  "cost": 5,
  "color": "fire",
  "params": {
   "amount": 3,
   "target": "ALL_ENEMY_UNITS",
   "self_damage": 1
  },
  "description": "Deal 3 damage to all enemy units (also damages itself)."
 },
 {
  "id": "guns_blazing",
  "name": "Guns Blazing",
  "template": "DIRECT_DAMAGE",
  "speed": "fast",
  "cost": 4,
  "color": "fire",
  "params": {
   "amount": 4,
   "target": "ENEMY_UNIT",
   "self_damage": 1
  },
  "description": "Deal 4 damage to an enemy unit (also damages itself)."
 },
 {
  "id": "harbingers_bite",
  "name": "Harbinger's Bite",
  "template": "DIRECT_DAMAGE",
  "speed": "fast",
  "cost": 3,
  "color": "shadow",
  "params": {
   "amount": 3,
   "target": "ENEMY_UNIT",
   "self_damage": 1
  },
  "description": "Deal 3 damage to an enemy unit (also damages itself)."
 },
 {
  "id": "ice_bolt",
  "name": "Ice Bolt",
  "template": "DIRECT_DAMAGE",
  "speed": "fast",
  "cost": 1,
  "color": "primal",
  "params": {
   "amount": 2,
   "target": "ANY_NEXUS",
   "apply_status": "FROZEN",
   "status_duration": 1
  },
  "description": "Deal 2 damage. Apply Frozen for 1 turn."
 },
 {
  "id": "ignite",
  "name": "Ignite",
  "template": "DIRECT_DAMAGE",
  "speed": "fast",
  "cost": 1,
  "color": "fire",
  "params": {
   "amount": 2,
   "target": "ENEMY_UNIT"
  },
  "description": "Deal 2 damage to an enemy unit."
 },
 {
  "id": "incineration",
  "name": "Incineration",
  "template": "DIRECT_DAMAGE",
  "speed": "fast",
  "cost": 3,
  "color": "fire",
  "params": {
   "amount": 4,
   "target": "ENEMY_UNIT"
  },
  "description": "Deal 4 damage to an enemy unit."
 },
 {
  "id": "just_desserts",
  "name": "Just Desserts",
  "template": "DIRECT_DAMAGE",
  "speed": "fast",
  "cost": 3,
  "color": "justice",
  "params": {
   "amount": 3,
   "target": "ENEMY_UNIT",
   "apply_status": "FROZEN",
   "status_duration": 1
  },
  "description": "Deal 3 damage to an enemy unit (freezes the target)."
 },
 {
  "id": "light_em_up",
  "name": "Light 'em Up",
  "template": "DIRECT_DAMAGE",
  "speed": "fast",
  "cost": 3,
  "color": "fire",
  "params": {
   "amount": 3,
   "target": "ENEMY_UNIT",